店铺名称,评论用户,用户id,评分,评论内容,评论时间,下单时间,处理时间,配送时间,配送评分,评论类型,评论id,图片数量,图片链接,标签,商家回复
小湘厨木桶饭,forevertoyouBing,667273454,5,点了很多次啦，非常好吃，非常入味，包装也很棒，吃饱饱没烦恼哈哈,1741795200,1741795200,1741877232,404,0,11,8496051877,1,http://p0.meituan.net/wmcomment/abdd8e9b3dcded775dc9ace33e81bc7b865576.jpg',,
小湘厨木桶饭,tpH775771698,1556412474,3,肉几片，豆腐很多，味道一般,1741536000,1741536000,1741581785,20,0,4,8485866577,3,"http://p0.meituan.net/wmcomment/d46fa0ccd5817e74d98ed5169f870d2c1252715.jpg', 'http://p0.meituan.net/wmcomment/22cb20e2b6cd0b009ab27f7f5a7938601139626.jpg', 'http://p0.meituan.net/wmcomment/6fb34ca4e8413ba3c5c7bf6094141c021287911.jpg'",,
小湘厨木桶饭,cchjv,2266283983,5,太划算了！优惠力度真的好大，份量够足，下次一定还会点的,1741449600,1741449600,1741490088,30,0,11,8482415956,2,"http://p0.meituan.net/wmcomment/6f87763f5169a995e38c9468e83c4e291237108.jpg', 'http://p0.meituan.net/wmcomment/bb04162d4f2b4daa2e650cb50a1453fa1115088.jpg'",,
小湘厨木桶饭,匿名用户,0,5,#烟笋炒肉＋木桶饭# #小碗福利 | 酸辣土豆丝（限购一份）# #收藏0元购 | 随机饮料#点过几次了，味道很不错，吃辣人士特别下饭。,1741449600,1741449600,1741508806,40,0,11,8483573472,4,"http://p0.meituan.net/wmcomment/7f5364fb4093b45f3321cbddc35b3a8a898176.jpg', 'http://p0.meituan.net/wmcomment/d0bbe4fee5255f4aa6670a2b2ef231bd772916.jpg', 'http://p0.meituan.net/wmcomment/08785ad7b9aa1164aa9ad5026040d531721953.jpg', 'http://p0.meituan.net/wmcomment/c4dd19abb63c017029253bf5fab643ca783607.jpg'",,
小湘厨木桶饭,匿名用户,0,5,很棒，下次还点,1741449600,1741449600,1741496427,29,0,4,8482928299,1,http://p0.meituan.net/wmcomment/aec56ae60a3fee4610ae0abe8c954c581077487.jpg',,
小湘厨木桶饭,昊昊runrunrun,1813977369,5,#【招牌特色】农家一碗香＋木桶饭#味道很好，很新鲜，份量大，推荐买，推荐推荐,1741449600,1741449600,1741507932,25,0,4,8483535821,2,"http://p0.meituan.net/wmcomment/3366a80b19e8ecde50fc87c4f3b4f9821072197.jpg', 'http://p0.meituan.net/wmcomment/5703da9063fcc193b8a6760db063b45e1002061.jpg'",,
小湘厨木桶饭,iCy155428796,2624947151,5,??餐品卖相真不错，卫生方面无可挑剔。套餐搭配合理出色，超级棒。包装完整严实，食材新鲜好吃，真赞！#【招牌特色】农家一碗香＋木桶饭#,1741449600,1741449600,1741491090,18,0,4,8482480267,2,"http://p0.meituan.net/wmcomment/2323f74539dece64d512293992a04e291327258.jpg', 'http://p0.meituan.net/wmcomment/3f1a906e8c85af9122b5aec12e66f2d41249522.jpg'","穿戴工服', '仪表整洁', '礼貌热情', '货品完好', '快速准时', '风雨无阻'",
小湘厨木桶饭,匿名用户,0,5,#【特色味道】香干腊肉＋木桶饭#好吃,1741363200,1741363200,1741406850,35,0,11,8479286456,1,http://p0.meituan.net/wmcomment/6afc2a77d5d9aa8a39c7475b001d80ce1188395.jpg',,
小湘厨木桶饭,gnC567924728,782864603,5,四季豆炒肉很好吃，米饭也挺好吃的,1741363200,1741363200,1741408442,46,0,11,8479437505,1,http://p0.meituan.net/wmcomment/58303c9e6fdbcdea2ff3963f19d0d24d794866.jpg',,
小湘厨木桶饭,Fzf874914713,1047251115,5,好吃好好吃，真的好香,1741363200,1741363200,1741408484,45,0,4,8479441429,1,http://p0.meituan.net/wmcomment/6068e3b35fd81449f546f26a7d9470511220173.jpg',,
小湘厨木桶饭,别碰我的蓝,2948070174,5,还是流心蛋蛋非常好吃下回继续来,1741363200,1741363200,1741410494,27,0,4,8479617211,2,"http://p0.meituan.net/wmcomment/8c1f431bddc94a59d93e2c05847ee0fb939206.jpg', 'http://p0.meituan.net/wmcomment/9e3de255323337e0b7bafd11cd12c4de864822.jpg'",,
小湘厨木桶饭,匿名用户,0,5,食物的温度保持得恰到好处，送到时还能感受到热气腾腾的美味。,1741276800,1741276800,1741308347,23,0,4,8475738605,1,http://p0.meituan.net/wmcomment/f4cc3ab79895b6f7219355d48277cabc204637.jpg',,感谢您对我们美食的赞赏，本店会继续努力保持食物的最佳状态，让您品尝到最美味的外卖。
小湘厨木桶饭,足迹3144,1717930467,5,食物的色香味俱全，商家的厨艺简直一流。每次品尝都像是在享受一场美食盛宴。,1741276800,1741276800,1741344083,68,0,4,8477429859,3,"http://p0.meituan.net/wmcomment/ffcc224523956625ef06ce140c08c96d641443.jpg', 'http://p0.meituan.net/wmcomment/e7876b4f4a2a9da2d56d3fb32e8a09c2632043.jpg', 'http://p0.meituan.net/wmcomment/6ffd8334c9285adf44eec903543184e2603515.jpg'",,感谢您的肯定，我们会继续努力提升品质，为您带来更好的美食体验！
小湘厨木桶饭,yycwlr,99969089,5,外卖小哥服务周到，送餐迅速！食物包装精美，味道满意。强烈推荐！,1741276800,1741276800,1741325510,36,0,4,8476608414,2,"http://p0.meituan.net/wmcomment/2af16c007db5a6b1d8a42aa2fd0178f7871921.jpg', 'http://p0.meituan.net/wmcomment/f80d29b2613bfe618f4ad230f187df38975164.jpg'",,感谢亲的肯定和推荐，我们会继续努力提升服务品质。本店会严格把控食品安全，确保餐品质量，为您提供更好的用餐体验。
小湘厨木桶饭,wjT549962730,3453221885,5,饭菜分量多 干净卫生 又好吃 喜欢的赶紧入手吧,1741276800,1741276800,1741320995,22,0,4,8476278206,3,"http://p0.meituan.net/wmcomment/82b7dc6e6b82d88caaa021cc607e9e1f339128.jpg', 'http://p0.meituan.net/wmcomment/c83662b6c27a6b57a1c9d7166469c6ba400988.jpg', 'http://p0.meituan.net/wmcomment/94d92603cf5bb1ba2a91ba261a0379c8383142.jpg'","货品完好', '快速准时', '仪表整洁', '穿戴工服', '礼貌热情', '风雨无阻'",感谢您的赞赏，我们的饭菜分量充足，卫生干净，口感美味。我们会继续努力，为您提供更好的服务，欢迎再次光临本店！
小湘厨木桶饭,Qnl407320529,1004957774,5,#烟笋炒肉＋木桶饭#味道也还可以了，份量真的也还可以了，真的是好吃不贵了，感谢老板了，谢谢,1741276800,1741276800,1741320827,27,0,11,8476261439,3,"http://p0.meituan.net/wmcomment/40d3d18f19b369e5e6ed8871729939361105672.jpg', 'http://p0.meituan.net/wmcomment/5cbc6b662dbc74fe3b868418993f8c001103222.jpg', 'http://p0.meituan.net/wmcomment/e3560627aceb507c4d95f0d8542c98ed1228080.jpg'",,感谢亲的认可，我们小店会继续努力提升菜品口感和份量，为您提供更好的用餐体验，祝您生活愉快！
小湘厨木桶饭,XkB179827556,1202187245,5,#【爆款主打】四季豆炒肉＋木桶饭#味道十分不错，好吃不贵，值得推荐,1741276800,1741276800,1741319180,124,0,4,8476109834,1,http://p0.meituan.net/wmcomment/7f1fe297430de54abd1d9074bee3d4391297627.jpg',,感谢您的光临和好评！我们的四季豆炒肉和木桶饭都是招牌菜，口感和味道都是我们精心调配出来的。我们一直致力于给顾客带来优质且物有所值的美食体验，您的好评是对我们最大的鼓励！
小湘厨木桶饭,XrI513800258,872566271,5,不得不说，这次点的外卖是我近期吃过最棒的！色香味俱全。,1741276800,1741276800,1741342184,40,0,11,8477304562,2,"http://p0.meituan.net/wmcomment/750fb01e0c802f78f6822d5fbb618c12700738.jpg', 'http://p0.meituan.net/wmcomment/4f5e0ad64dae6a0e8126e197d83621d5669234.jpg'",,感谢您的夸奖，我们会继续努力提升品质，为您提供更优质的服务，期待您的下次光临。
小湘厨木桶饭,forevertoyouBing,667273454,5,这家店我已经回购很多次了，包括周围的朋友都被自己疯狂安利，送货速度很快，不到30分钟就送到了，五分好评走起，下次继续吃，真的超满足,1741190400,1741190400,1741241205,175,0,11,8473841319,1,http://p0.meituan.net/wmcomment/43a142593b2a637b0683e4a959ac1594863955.jpg',,感谢亲的认可和支持，我们会继续努力提升品质和服务，让每位顾客都能享受到美味佳肴。祝您生活愉快，欢迎下次光临小店！
小湘厨木桶饭,L小木生,259135953,5,味道还不错 饭都全部吃完了,1741190400,1741190400,1741241294,36,0,4,8473844912,1,http://p0.meituan.net/wmcomment/572c02696c746cc2d17655762f434228200548.jpg',,感谢您的认可，我们会继续努力提升品质和服务，祝您生活愉快！
小湘厨木桶饭,匿名用户,0,5,#【单人套餐】腐竹红烧肉+米饭+饮料（亏本冲销量）#好吃分量很多腐竹很入味,1741190400,1741190400,1741236588,256,0,4,8473600100,3,"http://p0.meituan.net/wmcomment/5d2d2ef56f9ecbcbfebb461bd6ac9572158158.jpg', 'http://p0.meituan.net/wmcomment/7a199757dca06a9ea79e212eacb92ee497074.jpg', 'http://p0.meituan.net/wmcomment/58ede59706f2210fc79bce509290cf9d186544.jpg'",,感谢您的惠顾，您的满意是我们的动力。我们会继续努力提升品质和服务，期待您下次光临小店。
小湘厨木桶饭,野汁棠,1738837620,5,很好吃，牛肉很嫩，辣椒也很得劲，份量多，吃的很巴适，爱了#野山椒牛肉+米饭（送饮料）#,1741190400,1741190400,1741226174,23,0,4,8472977308,1,http://p0.meituan.net/wmcomment/4da00b29df6881ed8be0697c68297cfb137750.jpg',,感谢亲的好评，很高兴牛肉和辣椒能让您满意。我们的野山椒牛肉+米饭套餐确实分量十足，让您吃得巴适。我们会继续努力提升品质，为您提供更好的服务！
小湘厨木桶饭,jQu512472877,950431499,5,#【特色味道】香干腊肉＋木桶饭#湘菜性价比很高，也很好吃，建议大家都试试。,1741190400,1741190400,1741236411,54,0,4,8473587337,1,http://p0.meituan.net/wmcomment/8d72393f8943ae88d9ff286edbc7d704858294.jpg',,感谢您的推荐和喜爱，我们的香干腊肉木桶饭深受欢迎，我们会继续努力提升品质和服务，祝您生活愉快！
小湘厨木桶饭,暴富暴美发大财,982537311,5,#青椒鸡蛋＋木桶饭# #青椒鸡蛋＋木桶饭#非常好吃的木桶饭，大家可以尝一尝。,1741104000,1741104000,1741173214,26,0,11,8471832647,2,"http://p0.meituan.net/wmcomment/f7508b272111cdc8a42b141470c844a5535481.jpg', 'http://p0.meituan.net/wmcomment/0dcc2a2864ab4209f489f30fad209d49532264.jpg'",,感谢您的肯定，我们的木桶饭很受欢迎。我们会继续努力提升品质，为您提供更好的用餐体验。
小湘厨木桶饭,匿名用户,0,5,味道可以，量也多,1741104000,1741104000,1741146728,84,0,4,8470430655,1,http://p0.meituan.net/wmcomment/d2c5af815189ec4add95dffc6cce4fbb967372.jpg',"风雨无阻', '快速准时'",感谢您的认可，本店会继续努力提升味道和份量，让您满意。
小湘厨木桶饭,匿名用户,0,5,#绝味啤酒鸭+米饭（味很地道）# #绝味啤酒鸭+米饭（味很地道）#第一次尝试 ，适合重口味人士，整体很下饭,1741104000,1741104000,1741148130,34,0,4,8470566096,3,"http://p0.meituan.net/wmcomment/457d378aba0e35e55c86c174b203a460810700.jpg', 'http://p0.meituan.net/wmcomment/f83a2f4f67317427a6cfa6eb87d9ada6931858.jpg', 'http://p0.meituan.net/wmcomment/9f362abc0cc02bd22f8388ef58795e21903633.jpg'",,感谢您的光临和好评！我们的啤酒鸭口味独特，确实很适合重口味的人士。如果您有任何其他建议或意见，欢迎随时与我们联系，我们会努力改进。
小湘厨木桶饭,匿名用户,0,5,好吃，好开胃,1741104000,1741104000,1741148239,44,0,4,8470576827,1,http://p0.meituan.net/wmcomment/0c4b5e39068db529cad06d5dfeb02bcf254421.jpg',,感谢亲的夸奖，我们会继续努力提供美味的食物。如果您有任何建议或需求，欢迎随时联系我们，小店一直都在努力改进中。
小湘厨木桶饭,匿名用户,0,1,难吃就算了，还那么贵！那么贵就算了，还那么难看！这卖相跟隔夜菜是的！人生中第一次给差评！,1741017600,1741017600,1741063119,27,0,10,8467908823,0,,,看到您的评论，非常自责。让顾客有良好的用餐体验一直是我们的目标。谢谢您的批评建议，让小店及时改正。小店承诺，下次您来一定会让您刮目相看
小湘厨木桶饭,tpH775771698,1556412474,4,感觉不错，好吃,1740758400,1740758400,1740805114,45,0,4,8459224861,0,,,感谢您的夸奖，我们会继续努力提升品质，为您提供更好的服务，祝您生活愉快！
小湘厨木桶饭,匿名用户,0,1,备注的西门放在南门还没个电话小票上地址没显示西门不能全怪骑手但是我发消息没反应还是自己找的外卖,1739808000,1739808000,1739851924,28,0,10,8428586168,1,http://p0.meituan.net/wmcomment/12540b9b18210ba353f73774e4400f79580960.jpg',送达不通知',城市那么大，遇到即是缘分，可惜小店没有珍惜这次缘分，真是痛心疾首！希望您再给一次机会，小店会万分珍惜！对于小店本次没给您带去优质的用餐体验，万分抱歉！
小湘厨木桶饭,ulN221855533,366365961,5,很美味,1737302400,1737302400,1737343210,21,0,4,8369359471,0,,,感谢您的赞赏，我们会继续努力提供美味的食物。如果您有任何其他反馈，欢迎随时告诉我们！
小湘厨木桶饭,AaF854436161,2706568566,4,味道还可以，米饭也不错,1736956800,1736956800,1736998170,29,0,4,8358482812,0,,,感谢您的认可，我们的菜品和米饭都是用心制作的，我们会继续努力提升品质，为您带来更好的用餐体验，祝您生活愉快！
小湘厨木桶饭,l360141001,1532659236,5,可以#【单人套餐】腐竹红烧肉+米饭+饮料（亏本冲销量）#,1736697600,1736697600,1736762240,35,0,4,8351355065,0,,,感谢您的惠顾！我们会继续努力提升品质和服务，希望给您带来更好的用餐体验，欢迎下次光临本店！
小湘厨木桶饭,匿名用户,0,2,少吃 看这肉反光,1736438400,1736438400,1736483539,31,0,4,8341733996,2,"http://p0.meituan.net/wmcomment/5334ec4f4f81e136b4d368d5ea23c98e1057203.jpg', 'http://p0.meituan.net/wmcomment/9ff2ea89f45f7a3d5abfa80b5f340a1e829079.jpg'",,亲，真的很抱歉，这是我们工作的疏忽，非常抱歉，我们一定加强管理改正相关流程，再次向您表达歉意！
小湘厨木桶饭,SdO303578231,2718708200,5,好吃,1735747200,1735747200,1735787793,24,0,4,8317842366,0,,,感谢您的光临，我们会继续努力提升品质，给您带来更好的体验，欢迎下次光临小店。
小湘厨木桶饭,JUBUER,656896913,5,老客户了,1735401600,1735401600,1735444642,31,0,11,8305651990,1,http://p0.meituan.net/wmcomment/83c604e24f96f1db14a75bccb941feaa1007960.jpg',"快速准时', '风雨无阻', '货品完好', '穿戴工服', '仪表整洁', '礼貌热情'",感谢您一直以来的支持和信任，我们会继续努力提升服务品质，期待您更多光临小店。
小湘厨木桶饭,JUBUER,656896913,5,,1735401600,1735401600,1735444752,44,0,4,8305661589,1,http://p0.meituan.net/wmcomment/f78bae4330eebeba2a5f5cb06c6ec0191007960.jpg',,谢谢您的惠顾和对我们的肯定
小湘厨木桶饭,JUBUER,656896913,5,,1735401600,1735401600,1735444719,32,0,4,8305658820,1,http://p0.meituan.net/wmcomment/e17fbd3d17589b51b462d64f2d95710a1007960.jpg',"仪表整洁', '穿戴工服', '礼貌热情', '快速准时', '风雨无阻', '货品完好'",世界上有一种深情叫做你点我的菜，我们一直在您身后给您最好最贴心的服务做您的小太阳，感谢您的支持与惠顾！
小湘厨木桶饭,JUBUER,656896913,5,好吃??每天点,1735401600,1735401600,1735444662,35,0,11,8305653737,1,http://p0.meituan.net/wmcomment/6fd49365c55b677de3d250ad75f3e58f1134080.jpg',"风雨无阻', '礼貌热情', '货品完好', '穿戴工服', '快速准时', '仪表整洁'",感谢您的赞赏，我们会继续努力提供美味的食物。如果您有任何其他反馈或建议，欢迎随时联系我们，我们会尽全力满足您的需求。
小湘厨木桶饭,匿名用户,0,1,很失望,1735142400,1735142400,1735206644,654,0,4,8297259547,0,,,给您造成困扰，小店追悔莫及！请您随时联系小店，及时给您补偿！感谢您光临本店，再次抱歉！
小湘厨木桶饭,JAY。命,428137978,4,挺好的挺好??,1734969600,1734969600,1735031154,24,0,4,8290819963,0,,,感谢您的肯定，我们会继续努力提升服务质量，祝您生活愉快！
小湘厨木桶饭,D,94794224,5,奈斯，额外加了火腿肠，好吃,1734624000,1734624000,1734664123,37,0,4,8276837395,1,http://p0.meituan.net/wmcomment/98a7b378b62aa9a78d774aa19a305485284643.jpg',,感谢您的赞赏，您额外加的火腿肠让美食更加美味。我们会继续努力提供美味的食物，祝您生活愉快！
小湘厨木桶饭,D,94794224,5,是我的宝藏外卖店了。老板人很好，基本要求都可以满足，也因为是现炒经常点他家，今天是第18次点这家外卖了,1734624000,1734624000,1734664055,44,0,4,8276833483,1,http://p0.meituan.net/wmcomment/ec37dcc73e607ceb1e49098f498bd6f9164850.jpg',,感谢亲的支持和鼓励，我们会继续努力提升菜品和服务质量，争取满足您的更多需求，祝您用餐愉快！
小湘厨木桶饭,CXX650853,125025522,5,份量很足啊，好好吃，米饭软硬也适中，下次还点，吃太快忘记拍个照了,1734624000,1734624000,1734678143,20,0,4,8277771604,0,,,谢谢亲的赞赏，我们的菜品份量足，口感也把控得恰到好处，您的肯定是我们最大的动力。期待您的再次光临，祝您生活愉快！
小湘厨木桶饭,D,94794224,5,好吃，现炒,1734624000,1734624000,1734664178,47,0,4,8276840534,1,http://p0.meituan.net/wmcomment/bb14fbdd5e732044cdb5056539b14d80170783.jpg',,感谢亲的赞赏，我们会继续努力提供现炒的美食，欢迎再次品尝！
小湘厨木桶饭,许清颖,121341649,4,天天点这道菜 饭和菜已吃干净！,1734537600,1734537600,1734576247,31,0,4,8273686801,0,,"快速准时', '货品完好'",感谢您的喜爱，我们会继续努力提供美味的食物。如果您有任何建议或需求，欢迎随时向我们反馈，小店为您服务。
小湘厨木桶饭,JUBUER,656896913,5,经常点  好吃 看着也有食欲,1734278400,1734278400,1734324947,32,0,11,8265220684,1,http://p0.meituan.net/wmcomment/3bbef7129d917db69a15112cfa82a7bf970440.jpg',"礼貌热情', '快速准时', '货品完好'",感谢您的常来支持，我们会继续努力提升品质，给您带来更好的用餐体验。
小湘厨木桶饭,QUp802358585,4467624775,4,味道好，值得推荐。就是饭比较少不怎么够呢，如果在点一份饭又是不下。希望饭多打个两勺就够吃了。味道好，好吃是主要,1733414400,1733414400,1733466039,30,0,4,8234225636,0,,快速准时',感谢您的赞赏，我们会在后续的餐品份量上加以关注，希望您能继续关注我们小店的其他美食推荐。
小湘厨木桶饭,bhe708066151,973544421,5,可以,1732377600,1732377600,1732437960,31,0,4,8198209409,1,http://p0.meituan.net/wmcomment/8dfd2e717800c02dd4e6192f16e56b7d157259.jpg',,感谢您的光临，我们会继续努力提升服务质量，祝您生活愉快！
小湘厨木桶饭,匿名用户,0,1,全是骨头，没有一块肉,1732118400,1732118400,1732185343,19,0,10,8189197297,0,,,提供给顾客优质的用餐体验是小店的梦想和信念！本次的问题让小店非常惭愧，小店一定会严于律己，改善这个问题，让您下次您光临的时候，一定是优质的用餐体验！
小湘厨木桶饭,WTJ840343796,289207649,5,不错,1731772800,1731772800,1731822948,14,0,4,8176285179,0,,,感谢您的光临，我们会继续努力提升服务质量，让您满意。
小湘厨木桶饭,匿名用户,0,2,今天的份量只有平时的一半，差评。 要做就好好就，一个菜炒得稀烂！,1731427200,1731427200,1731470710,35,0,4,8163370524,1,http://p0.meituan.net/wmcomment/9547b2094bbed8021f69318ff642e4d4482696.jpg',,亲爱的顾客，对于本次问题先给您致歉，如果再来一次的话，本店一定会注意，争取给您带去优质的用餐体验！希望您能再次光临！
小湘厨木桶饭,cXB281100442,933732284,5,#农家一碗香＋米饭#味道不错好吃，分量很足,1731340800,1731340800,1731408917,26,0,4,8161759647,1,http://p0.meituan.net/wmcomment/27231f45791a1e461594601311de499e654302.jpg',,感谢您对我们的支持和肯定，我们会继续努力提供美味的农家一碗香和充足的米饭，为您带来更好的用餐体验。
小湘厨木桶饭,匿名用户,0,5,经常点这家，分量足，味道很不错,1731340800,1731340800,1731383386,32,0,4,8160392646,2,"http://p0.meituan.net/wmcomment/11e8ec081356f5b3d9b43a452cfa9b46936299.jpg', 'http://p0.meituan.net/wmcomment/ab5f86fb215f90a244f96b87280376781104508.jpg'",,感谢您的认可和支持，我们会继续努力提供美味的餐品和优质的服务。
小湘厨木桶饭,Uze562014451,2786782161,5,#土豆片排骨+米饭#,1731340800,1731340800,1731386530,94,0,11,8160705503,1,http://p0.meituan.net/wmcomment/7f34480a41934cd26048f81850cf757f1032852.jpg',,感谢您的宝贵意见，我们会持续改进，努力做得更好。
小湘厨木桶饭,向日葵,3350119557,5,外卖超美味，量足且配送神速,1731340800,1731340800,1731420416,37,0,4,8162377889,2,"http://p0.meituan.net/wmcomment/7e55767dda2c8e9c2282822cd1061eb3446200.jpg', 'http://p0.meituan.net/wmcomment/fa081d7284513a7221ef0f7e4826427d373140.jpg'",,感谢您的赞赏，我们的外卖味道和分量都经过严格把控，配送速度也是我们的服务亮点。我们会继续努力，为您提供更好的服务！
小湘厨木桶饭,稚始挚终丶,294092346,5,这家外卖的卫生无可指摘，食物美味得超乎想象，真是一次完美的用餐体验！,1731340800,1731340800,1731405726,37,0,4,8161545596,3,"http://p0.meituan.net/wmcomment/ef018751c7eb7fcd54e95184edd77137786177.jpg', 'http://p0.meituan.net/wmcomment/23621bf8f2fc062b900dc4146e3161fa960627.jpg', 'http://p0.meituan.net/wmcomment/655193f41e895e9af7ceb75e538aaecc875405.jpg'",,感谢您的夸奖，我们会继续努力提供高品质的美食和服务，期待您下次的光临。
小湘厨木桶饭,AnM365053249,3504616145,5,#香干腊肉+米饭#很好很不错,1731254400,1731254400,1731298650,37,0,11,8157771300,1,http://p0.meituan.net/wmcomment/34ebe358517363610fd807bb15c39e63684104.jpg',,感谢您的赞赏，我们会继续努力提升品质和服务，让您每次点餐都有美好的体验！
小湘厨木桶饭,FbM326973137,932624562,5,味道很好，不是第一次点了，真的好吃，分量大#冬菇滑鸡+米饭# #小碗福利 | 酸辣土豆丝（限购一份）#,1731254400,1731254400,1731302021,75,0,4,8158032995,2,"http://p0.meituan.net/wmcomment/193e03454623309bef9a38be54693296179227.jpg', 'http://p0.meituan.net/wmcomment/9782f5bb25c54ecb4a0f36edad9fe97c180727.jpg'","仪表整洁', '快速准时', '穿戴工服'",感谢您的光顾和好评，我们会继续努力提升品质和服务，让您有更好的用餐体验，欢迎再次光临本店。
小湘厨木桶饭,草樵有豆,303247322,5,量大管饱，还有一碗豆腐，价格真的美丽,1731254400,1731254400,1731298136,26,0,11,8157717337,1,http://p0.meituan.net/wmcomment/91c6832753411505685dfabf40d13fbe117953.jpg',,谢谢你，我们会如滔滔江水般持之以恒地继续努力，只为您满意！
小湘厨木桶饭,SdO303578231,2718708200,5,#农家一碗香＋米饭#老板人太实在了，给的份量非常足，味道也是大众口味，性价比超高，以后就是非常想点这一家了。味道好极了，份量也多，我觉得特别棒，值得推荐给大家，下次还会点的。玫瑰玫瑰玫瑰玫瑰玫瑰#小碗福利 | 酸辣土豆丝（限购一份）#,1731168000,1731168000,1731234168,13,0,11,8155976382,2,"http://p0.meituan.net/wmcomment/83324ddc7f55cec175a3790e94b3f3ab980907.jpg', 'http://p0.meituan.net/wmcomment/810066e31cd5e8a41ba375ca12b989d7980907.jpg'",,感谢您的夸赞，我们会继续努力提升品质和服务，为您带来更好的用餐体验，您的满意是我们最大的动力。农家一碗香米饭口感足、性价比高，是您值得信赖的餐厅。
小湘厨木桶饭,pQu246650795,872166058,5,可以,1731168000,1731168000,1731207782,44,0,4,8154348806,1,http://p0.meituan.net/wmcomment/e10ccf02fce041b6576e4a3790fd1f0e533132.jpg',,感谢您的认可，我们会继续努力提升服务质量，让您有更好的用餐体验。
小湘厨木桶饭,zx你超棒的,1439325249,5,#烟笋炒肉+米饭#分量很多也很好吃！！！感觉有点辣辣的更好吃了，对江西人很友好??,1731168000,1731168000,1731211262,31,0,4,8154600865,1,http://p0.meituan.net/wmcomment/4f9c039f1817f7ae76ce34c2b38ed9121409075.jpg',,感谢您的肯定，我们的烟笋炒肉确实分量足，口味偏辣，很受欢迎。我们会继续努力，为您提供更好的服务！
小湘厨木桶饭,gHJ597823331,735608809,5,,1762444800,1762444800,1762477843,43,0,4,9255866981,0,,,亲爱的顾客，感谢您对我们店铺的评价与支持，当我们的用心烹饪的菜品得到您的肯定时，是我们最开心的时刻！期待您下次光临小店哦！
小湘厨木桶饭,gHJ597823331,735608809,5,,1762358400,1762358400,1762431687,29,0,4,9254981378,0,,,哎呀妈呀，收到好评以后头也不疼了，眼也不花了，又能继续干活了！^.^谢谢亲的支持
小湘厨木桶饭,FGH33,525028471,5,,1762272000,1762272000,1762315336,27,0,4,9250503075,0,,,自从收到亲的好评，头也不疼了，眼也不花了，又能继续干活了！谢谢亲的支持！
小湘厨木桶饭,匿名用户,0,5,,1762272000,1762272000,1762338974,34,0,4,9251681041,0,,,我们掌柜的说了，如果今天没有100条好评就要打断我的腿，客官你可得救救我帮我多美言几句啊！
